<?xml version="1.0" encoding="UTF-8"?>
<curriculum xmlns:xsi="http://www.w3.org/2001/XMLSchema-instance"
    xsi:noNamespaceSchemaLocation="curriculum.xsd">
    <datos_personales>

        <nombre>Mario</nombre>
        <apellidos>Ortega Pérez</apellidos>
        <fecha_nacimiento>2005-05-04</fecha_nacimiento>
        <lugar_nacimiento>Granada</lugar_nacimiento>
        <nacionalidad>Español</nacionalidad>
        <n_identificacion tipo="nie">93181244H</n_identificacion>
        <archivo_foto></archivo_foto>

    </datos_personales>

    <datos_contacto>

        <tipo_via>Calle</tipo_via>
        <nombre_via>Mirador de Montepinar</nombre_via>
        <numero>1</numero>
        <escalera>Derecha</escalera>
        <piso>2</piso>
        <puerta>B</puerta>
        <codigo_postal>18007</codigo_postal>
        <pais>España</pais>
        <email>mortper0408@ieszaidinvergeles.org</email>
        <telefono_movil>23</telefono_movil>
        <telefono_fijo>0</telefono_fijo>

    </datos_contacto>

    <datos_opcionales>

        <pagina_web>mariortegaperez83.github.io</pagina_web>
        <cuenta_red_social>mario_ortega83</cuenta_red_social>

    </datos_opcionales>


    <formacion_academica>

        <nombre>Titulado en Oxford</nombre>
        <centro>Oxford</centro>
        <fecha_inicio>2023-12-12</fecha_inicio>
        <fecha_fin>2023-12-12</fecha_fin>

    </formacion_academica>
    
    <formacion_academica>

        <nombre>Titulado en Bachillerato Tecnológico</nombre>
        <centro>Centro Salesiano San Juan Bosco</centro>
        <fecha_inicio>2023-12-12</fecha_inicio>
        <fecha_fin>2023-12-12</fecha_fin>

    </formacion_academica>


    <formacion_academica>

        <nombre>Técnico Superior de Desasrrollo de Aplicaciones Web</nombre>
        <centro>IES Zaidin-Vergeles</centro>
        <fecha_inicio>2023-09-15</fecha_inicio>
        <fecha_fin>2025-06-16</fecha_fin>

    </formacion_academica>




    <idiomas>

        <idioma>Ingles</idioma>
        <nivel_comprension_oral>alto</nivel_comprension_oral>
        <nivel_expresion_oral>medio</nivel_expresion_oral>
        <nivel_comprension_escrita>alto</nivel_comprension_escrita>
        <nivel_expresion_escrita>alto</nivel_expresion_escrita>
        <nivel_titulo>A2</nivel_titulo>

    </idiomas>

    <idiomas>

        <idioma>Frances</idioma>
        <nivel_comprension_oral>alto</nivel_comprension_oral>
        <nivel_expresion_oral>medio</nivel_expresion_oral>
        <nivel_comprension_escrita>alto</nivel_comprension_escrita>
        <nivel_expresion_escrita>alto</nivel_expresion_escrita>
        <nivel_titulo>C1</nivel_titulo>

    </idiomas>
    
    <idiomas>

        <idioma>Alemán</idioma>
        <nivel_comprension_oral>alto</nivel_comprension_oral>
        <nivel_expresion_oral>medio</nivel_expresion_oral>
        <nivel_comprension_escrita>alto</nivel_comprension_escrita>
        <nivel_expresion_escrita>alto</nivel_expresion_escrita>
        <nivel_titulo>B2</nivel_titulo>

    </idiomas>


    <experiencia_laboral>

        <lugar></lugar> 
        <puesto></puesto>
        <fecha_inicio>2345-12-12</fecha_inicio>
        <fecha_fin>1232-12-21</fecha_fin>
        
    </experiencia_laboral>


    <competencias_socio-profesionales>

        <competencia></competencia>
        <nivel></nivel>

    </competencias_socio-profesionales>

    <datos_adiccionales>

        <aficiones></aficiones>
        <disponibilidad></disponibilidad>
        <vehiculo_propio></vehiculo_propio>
        <licencias></licencias>

    </datos_adiccionales>

</curriculum>